{
  "version": "0.1",
  "impl": "sec4",
  "env": null,
  "summaries": [
    {
      "impl": "sec4",
      "endpoint": "ping",
      "targetRps": 10000,
      "requestsPerSec": 9801.5,
      "latency": {
        "p50": "1.20ms",
        "p95": "2.90ms",
        "p99": "4.30ms",
        "max": "10.00ms"
      }
    },
    {
      "impl": "sec4",
      "endpoint": "decode",
      "targetRps": 2000,
      "requestsPerSec": 1780.2,
      "latency": {
        "p50": "3.80ms",
        "p95": "8.20ms",
        "p99": "14.60ms",
        "max": "29.00ms"
      }
    },
    {
      "impl": "sec4",
      "endpoint": "users-post",
      "targetRps": 500,
      "requestsPerSec": 470.9,
      "latency": {
        "p50": "6.20ms",
        "p95": "12.50ms",
        "p99": "19.40ms",
        "max": "35.00ms"
      }
    }
  ],
  "secAudit": null,
  "selectedEndpoints": null
}
